{
  "name": "林茜_世界书_v1.3.32",
  "entryFiles": [
    "worldbooks/linxi/entries/e000.json",
    "worldbooks/linxi/entries/e001.json",
    "worldbooks/linxi/entries/e002.json",
    "worldbooks/linxi/entries/e003.json",
    "worldbooks/linxi/entries/e004.json",
    "worldbooks/linxi/entries/e005.json",
    "worldbooks/linxi/entries/e006.json",
    "worldbooks/linxi/entries/e007.json",
    "worldbooks/linxi/entries/e008.json",
    "worldbooks/linxi/entries/e009.json",
    "worldbooks/linxi/entries/e010.json",
    "worldbooks/linxi/entries/e011.json",
    "worldbooks/linxi/entries/e012.json",
    "worldbooks/linxi/entries/e013.json",
    "worldbooks/linxi/entries/e014.json",
    "worldbooks/linxi/entries/e015.json",
    "worldbooks/linxi/entries/e016.json",
    "worldbooks/linxi/entries/e017.json",
    "worldbooks/linxi/entries/e018.json",
    "worldbooks/linxi/entries/e019.json",
    "worldbooks/linxi/entries/e020.json",
    "worldbooks/linxi/entries/e021.json",
    "worldbooks/linxi/entries/e022.json",
    "worldbooks/linxi/entries/e023.json",
    "worldbooks/linxi/entries/e024.json",
    "worldbooks/linxi/entries/e025.json",
    "worldbooks/linxi/entries/e026.json",
    "worldbooks/linxi/entries/e027.json",
    "worldbooks/linxi/entries/e028.json",
    "worldbooks/linxi/entries/e029.json",
    "worldbooks/linxi/entries/e030.json",
    "worldbooks/linxi/entries/e031.json",
    "worldbooks/linxi/entries/e032.json",
    "worldbooks/linxi/entries/e033.json",
    "worldbooks/linxi/entries/e034.json",
    "worldbooks/linxi/entries/e035.json",
    "worldbooks/linxi/entries/e036.json",
    "worldbooks/linxi/entries/e037.json",
    "worldbooks/linxi/entries/e038.json",
    "worldbooks/linxi/entries/e039.json",
    "worldbooks/linxi/entries/e040.json",
    "worldbooks/linxi/entries/e041.json",
    "worldbooks/linxi/entries/e042.json",
    "worldbooks/linxi/entries/e043.json",
    "worldbooks/linxi/entries/e044.json",
    "worldbooks/linxi/entries/e045.json",
    "worldbooks/linxi/entries/e046.json",
    "worldbooks/linxi/entries/e047.json",
    "worldbooks/linxi/entries/e048.json",
    "worldbooks/linxi/entries/e049.json",
    "worldbooks/linxi/entries/e050.json",
    "worldbooks/linxi/entries/e051.json",
    "worldbooks/linxi/entries/e052.json",
    "worldbooks/linxi/entries/e053.json",
    "worldbooks/linxi/entries/e054.json",
    "worldbooks/linxi/entries/e055.json",
    "worldbooks/linxi/entries/e056.json",
    "worldbooks/linxi/entries/e057.json",
    "worldbooks/linxi/entries/e058.json",
    "worldbooks/linxi/entries/e059.json",
    "worldbooks/linxi/entries/e060.json",
    "worldbooks/linxi/entries/e061.json",
    "worldbooks/linxi/entries/e062.json",
    "worldbooks/linxi/entries/e063.json",
    "worldbooks/linxi/entries/e064.json",
    "worldbooks/linxi/entries/e065.json",
    "worldbooks/linxi/entries/e066.json",
    "worldbooks/linxi/entries/e067.json",
    "worldbooks/linxi/entries/e068.json",
    "worldbooks/linxi/entries/e069.json",
    "worldbooks/linxi/entries/e070.json",
    "worldbooks/linxi/entries/e071.json",
    "worldbooks/linxi/entries/e072.json",
    "worldbooks/linxi/entries/e073.json",
    "worldbooks/linxi/entries/e074.json",
    "worldbooks/linxi/entries/e075.json",
    "worldbooks/linxi/entries/e076.json",
    "worldbooks/linxi/entries/e077.json",
    "worldbooks/linxi/entries/e078.json",
    "worldbooks/linxi/entries/e079.json",
    "worldbooks/linxi/entries/e080.json",
    "worldbooks/linxi/entries/e081.json",
    "worldbooks/linxi/entries/e082.json",
    "worldbooks/linxi/entries/e083.json",
    "worldbooks/linxi/entries/e084.json",
    "worldbooks/linxi/entries/e085.json",
    "worldbooks/linxi/entries/e086.json",
    "worldbooks/linxi/entries/e087.json",
    "worldbooks/linxi/entries/e088.json",
    "worldbooks/linxi/entries/e089.json",
    "worldbooks/linxi/entries/e090.json",
    "worldbooks/linxi/entries/e091.json",
    "worldbooks/linxi/entries/e092.json",
    "worldbooks/linxi/entries/e093.json",
    "worldbooks/linxi/entries/e094.json",
    "worldbooks/linxi/entries/e095.json",
    "worldbooks/linxi/entries/e096.json",
    "worldbooks/linxi/entries/e097.json",
    "worldbooks/linxi/entries/e098.json",
    "worldbooks/linxi/entries/e099.json",
    "worldbooks/linxi/entries/e100.json",
    "worldbooks/linxi/entries/e101.json",
    "worldbooks/linxi/entries/e102.json",
    "worldbooks/linxi/entries/e103.json",
    "worldbooks/linxi/entries/e104.json",
    "worldbooks/linxi/entries/e105.json",
    "worldbooks/linxi/entries/e106.json",
    "worldbooks/linxi/entries/e107.json",
    "worldbooks/linxi/entries/e108.json",
    "worldbooks/linxi/entries/e109.json",
    "worldbooks/linxi/entries/e110.json",
    "worldbooks/linxi/entries/e111.json",
    "worldbooks/linxi/entries/e112.json",
    "worldbooks/linxi/entries/e113.json",
    "worldbooks/linxi/entries/e114.json",
    "worldbooks/linxi/entries/e115.json",
    "worldbooks/linxi/entries/e116.json",
    "worldbooks/linxi/entries/e117.json",
    "worldbooks/linxi/entries/e118.json",
    "worldbooks/linxi/entries/e119.json",
    "worldbooks/linxi/entries/e120.json",
    "worldbooks/linxi/entries/e121.json",
    "worldbooks/linxi/entries/e122.json",
    "worldbooks/linxi/entries/e123.json",
    "worldbooks/linxi/entries/e124.json",
    "worldbooks/linxi/entries/e125.json",
    "worldbooks/linxi/entries/e126.json",
    "worldbooks/linxi/entries/e127.json",
    "worldbooks/linxi/entries/e128.json",
    "worldbooks/linxi/entries/e129.json",
    "worldbooks/linxi/entries/e130.json",
    "worldbooks/linxi/entries/e131.json",
    "worldbooks/linxi/entries/e132.json"
  ],
  "scanDepth": 4,
  "caseSensitive": false,
  "matchWholeWords": false,
  "recursive": false,
  "maxRecursionSteps": 0
}
